<?xml version="1.0" encoding="UTF-8"?>
<psychic_powers xmlns:xsi="http://www.w3.org/2001/XMLSchema-instance"
	xsi:noNamespaceSchemaLocation="validation/punkapocalyptic-model-psychic-power.xsd">
	<psychic_power>
		<name>disarm</name>
	</psychic_power>
	<psychic_power>
		<name>enhancement</name>
	</psychic_power>
	<psychic_power>
		<name>master_of_puppets</name>
	</psychic_power>
	<psychic_power>
		<name>mindshock</name>
	</psychic_power>
	<psychic_power>
		<name>psychic_barrier</name>
	</psychic_power>
</psychic_powers>